{
  "candidate_id": "t10-fpu-core-v1",
  "config_sha256": "0000000000000000000000000000000000000000000000000000000000000000",
  "falsifier": "Final pivot-02 is one no-control core. Reject to DNF on insolvency, missing metrics, base or doubled return <=0, base Sharpe <0.75, doubled Sharpe <0.35, fewer than four positive folds, any nonpositive bull/bear/chop or long-bull/short-bear/combined-chop role, any sleeve floor failure, any team-declared A5 failure, drawdown above 0.30, Calmar below 0.40, or any other numeric gate. Controls, ablations, and neighbors cannot rescue it.",
  "family_id": "t10-funding-pressure-unwind-v1",
  "parameters": {
    "_top40_v2_score_adapter": {
      "adapter_id": "top40-v2-declared-score-boundary-v1",
      "manifest_sha256": "0000000000000000000000000000000000000000000000000000000000000000",
      "schema_version": 1
    },
    "decision_interval_hours": 168,
    "funding_lookback_days": 14,
    "funding_persistence_weight": 0.3,
    "gross_exposure": 0.12,
    "interval_hours": 8,
    "maximum_abs_funding_rate": 0.01,
    "maximum_abs_one_bar_return": 0.2,
    "maximum_abs_tail_return": 0.35,
    "maximum_annualized_volatility": 1.5,
    "maximum_funding_staleness_hours": 24,
    "maximum_log_price_range": 0.7,
    "maximum_symbol_weight": 0.02,
    "maximum_window_drawdown": 0.45,
    "minimum_cross_section": 12,
    "minimum_funding_events": 12,
    "minimum_positive_volume_fraction": 0.8,
    "minimum_score_spread": 0.75,
    "minimum_scored_symbols": 10,
    "minimum_selected_abs_score": 0.25,
    "price_history_bars": 64,
    "recent_funding_events": 3,
    "retention_rank_buffer": 2,
    "robust_z_clip": 4.0,
    "selection_count_per_side": 4,
    "tail_horizon_bars": 21,
    "volatility_horizon_bars": 42
  },
  "risk_config_sha256": "0000000000000000000000000000000000000000000000000000000000000000",
  "seed": 20260801,
  "source_bundle_sha256": "0000000000000000000000000000000000000000000000000000000000000000",
  "strategy_sha256": "0000000000000000000000000000000000000000000000000000000000000000",
  "team_id": "team-10",
  "thesis": "Without controls, a 0.12-gross weekly funding-pressure book can express a low-pressure long role in bull, a high-positive-pressure short role in bear, and two-sided funding-transfer/crowding normalization in chop, while avoiding the failed price-anchor mechanism's pervasive negative alpha and churn.",
  "timestamp_utc": "REPLACE_WITH_ACTUAL_REGISTRATION_TIMESTAMP_Z"
}
