{
  "candidate_id": "t03-rlsa-base-h3-b30-v21-f25",
  "config_sha256": "bd0e4f70bcf335b2ac4e44ec049b89b8e8eaf4c6ac6502574d0accf12d9d9947",
  "falsifier": "Reject immediately for causal-test failure, nondeterminism, invalid execution, insolvency, nonpositive no-control OOF Sharpe, fewer than four positive folds, nonpositive bull/bear/chop return, nonpositive long-bull or short-bear attribution, nonpositive doubled-cost Sharpe, or drawdown above 40%. Risk controls cannot rescue a failed base mechanism.",
  "family_id": "t03-residual-liquidity-shock-absorption-v1",
  "parameters": {
    "beta_lookback_days": 30,
    "directional_gross_tilt": 0.05,
    "funding_lookback_days": 30,
    "funding_recent_days": 3,
    "funding_weight": 0.25,
    "minimum_funding_events": 12,
    "minimum_names_per_side": 5,
    "minimum_valid_symbols": 20,
    "per_symbol_target_cap": 0.08,
    "rank_tail_fraction": 0.25,
    "rebalance_hour_utc": 0,
    "residual_variance_floor": 1e-08,
    "residual_volatility_lookback_days": 21,
    "shock_horizon_bars": 3,
    "total_gross": 0.8,
    "trend_lookback_days": 60,
    "trend_threshold": 0.1,
    "volume_amplifier": 0.35,
    "volume_lookback_days": 30
  },
  "risk_config_sha256": "5d862a75a08b6ffbb4683789efbb1b7338b30f024ddf381d1a95736148702bbc",
  "seed": 20260801,
  "source_bundle_sha256": "50de628803f4ff714f3e36c3a4ec11c8b017a69ad0993c02bd92891a3086e73a",
  "strategy_sha256": "1d867c254b6456560dbd55a63f470e300cd901929ca5aee26cd360891635cd57",
  "team_id": "team-03",
  "thesis": "High-volume moves unexplained by rolling BTC beta and reinforced by same-side funding partly reflect temporary forced-flow impact; diversified exhaustion tails should reverse.",
  "timestamp_utc": "2026-07-16T10:37:15Z"
}
