{
  "candidate_id": "t08-volatility-scaled-rank-persistence-v1-base",
  "config_sha256": "0000000000000000000000000000000000000000000000000000000000000000",
  "falsifier": "Reject if the exact no-control core misses net Sharpe 0.75, positive annualized return, Calmar 0.40, drawdown at most 0.30, doubled-cost Sharpe 0.35 and positive return, trial-adjusted probability 0.90, four profitable folds, positive-quarter fraction 0.55, worst-regime Sharpe -0.25, three positive regime Sharpes, positive bull/bear/chop return and Sharpe, positive long-bull/short-bear/combined-chop attribution, either sleeve floor (0.01 exposure, 0.10 active fraction, 0.01 mean exposure, 1000 USDT notional), concentration 0.40, complete A5 coverage, positive pooled IC, or four positive fold ICs. After those non-neighborhood gates pass, require 0.70 profitable neighbors and median neighbor Sharpe 0.50. Controls, neighbors, ablations, private data, and sign inversion cannot rescue failure.",
  "family_id": "t08-volatility-scaled-rank-persistence-v1",
  "parameters": {"_top40_v2_score_adapter": {"adapter_id": "top40-v2-declared-score-boundary-v1", "manifest_sha256": "0000000000000000000000000000000000000000000000000000000000000000", "schema_version": 1}, "bar_interval_hours": 8, "baseline_volatility_bars": 105, "disagreement_power": 2.0, "gross_target": 0.36, "history_return_bars": 126, "horizon_saturation_z": 3.0, "maximum_symbol_exposure": 0.025, "medium_horizon_bars": 63, "medium_horizon_weight": 0.3, "minimum_agreeing_horizons": 2, "minimum_positions_per_side": 8, "minimum_valid_symbols": 24, "rebalance_interval_bars": 21, "recent_volatility_bars": 21, "selected_fraction_per_side": "1/5", "short_horizon_bars": 21, "short_horizon_weight": 0.5, "slow_horizon_bars": 126, "slow_horizon_weight": 0.2},
  "risk_config_sha256": "0000000000000000000000000000000000000000000000000000000000000000",
  "seed": 20260801,
  "source_bundle_sha256": "0000000000000000000000000000000000000000000000000000000000000000",
  "strategy_sha256": "0000000000000000000000000000000000000000000000000000000000000000",
  "team_id": "team-08",
  "thesis": "Volatility-scaled three-horizon residual persistence earns weekly relative alpha without a common-direction bet.",
  "timestamp_utc": "1970-01-01T00:00:00Z"
}
