{
  "timestamp_utc": "2026-07-18T08:08:09Z",
  "team_id": "team-05",
  "family_id": "team05-causal-residual-trend-reversal-v1",
  "candidate_id": "team05-crtr-core-v2-infra-r1",
  "strategy_sha256": "4188181fbf28f805c9df0c11e5eb0244235aedc7938f5beb27d3614b86dc58c0",
  "source_bundle_sha256": "53c5ae7080d5e5983b9a5ae31e8d9cb0dba456a350d8163bf9a8ac6fc77913f3",
  "risk_config_sha256": "6d26816cb61be1267084acbf689161baa39d4bbbcb3bb62fe686ec0c8ee5d9b4",
  "config_sha256": "bd0e4f70bcf335b2ac4e44ec049b89b8e8eaf4c6ac6502574d0accf12d9d9947",
  "parameters": {
    "_top40_v2_administrative_replacement": {
      "amendment_id": "top40-v2-amendment-0008-team05-infrastructure-replacement",
      "failed_candidate_id": "team05-crtr-core-v2",
      "freeze_commit": "f6003ae687d5a6bf665abb001715b01ea8b10abb",
      "freeze_path": "tournament/top40-v2/amendments/0008/freeze.json",
      "freeze_sha256": "08bf194c9ade1f66bf38012210ad8604df61ca467cdad00bd3957aa679ea9bdd",
      "maximum_development_runs": 1,
      "replacement_material_trial_number": 2,
      "scientific_delta": "none"
    },
    "_top40_v2_score_adapter": {
      "adapter_id": "top40-v2-declared-score-boundary-v1",
      "manifest_sha256": "43b1addea40aa9bfa0b3999170aab31a0eef7a6fbd02e5f6d9eae66a6350c6d3",
      "schema_version": 1
    },
    "_top40_v2_runtime_authority": {
      "active_entrypoint_path": "scripts/top40_v2_tournament_runtime_preload_v7.py",
      "active_entrypoint_sha256": "8a4ada10176d2606df3f358fc188e21b45153ad9a7270f36908736f03322a3a9",
      "amendment_id": "top40-v2-amendment-0007-frozen-worker-a5-protocol-preload",
      "integration_freeze_commit": "c8b917ca49306d5200a4e08848e73ff6f5a18bf3",
      "integration_freeze_path": "tournament/top40-v2/amendments/0007/integration-freeze.json",
      "integration_freeze_sha256": "6f77a146e7b414eabd20c5cc9321a95493bb98116dde07ef79d9eb009b6a6f51"
    },
    "base_candidate_id": "team05-crtr-base-v1",
    "strategy_parameters": "frozen_config.json",
    "risk_policy_cell": "ablations.json:risk-none using risk_policy.json",
    "evaluator_cost_outputs": [
      1.0,
      2.0
    ],
    "fold_plan": "walk_forward_plan.json",
    "activation_precondition": "existing family preserved; active A5/A6/A7 authority and frozen A8 one-shot replacement authority verified; executable-source manifest, independent semantic review, and score manifest immutable first-adds accepted in strict order"
  },
  "seed": 20260801,
  "thesis": "CRTR intermediate relative continuation plus direction-conditioned short reversal should support bull-long, bear-short, and combined-chop roles at conservative exposure.",
  "falsifier": "Any official or Team-05 hard gate, causal test, declared sleeve role, doubled-cost threshold, fold threshold, or gated neighborhood threshold fails."
}
