{
  "candidate_id": "t06-relative-rank-persistence-v1-base",
  "config_sha256": "bd0e4f70bcf335b2ac4e44ec049b89b8e8eaf4c6ac6502574d0accf12d9d9947",
  "falsifier": "Reject if this exact no-control core fails any official central-development threshold or any stricter aggregate, doubled-cost, bull, bear, chop, role, fold, quarter, regime, sleeve, concentration, A5 coverage, or score-IC gate. Controls, neighbors, diagnostics, and private data cannot rescue this family.",
  "family_id": "t06-relative-rank-persistence-v1",
  "parameters": {
    "_top40_v2_score_adapter": {
      "adapter_id": "top40-v2-declared-score-boundary-v1",
      "manifest_sha256": "9666f99eed0a21192bc8f700aa1f8d44e36662fa97b863a92ee3e8700ff0627d",
      "schema_version": 1
    },
    "acceleration_weight": 0.65,
    "bar_interval_hours": 8,
    "baseline_rank_bars": 72,
    "coherence_base_weight": 0.5,
    "level_weight": 0.35,
    "maximum_symbol_exposure": 0.025,
    "minimum_positions_per_side": 8,
    "minimum_rank_volatility": 0.2,
    "minimum_valid_symbols": 24,
    "prior_rank_bars": 12,
    "rebalance_interval_bars": 12,
    "recent_rank_bars": 12,
    "risk_parameters": {
      "drawdown_brakes": [],
      "position_stop": {
        "cooldown_bars": 3,
        "enabled": false,
        "loss_fraction": 0.1
      },
      "same_boundary_reentry": false,
      "side_scaling": {
        "long_scale": 1.0,
        "short_scale": 1.0
      },
      "time_stop": {
        "cooldown_bars": 3,
        "enabled": false,
        "maximum_holding_bars": 21
      },
      "turnover_limit": {
        "enabled": false,
        "maximum_one_way_turnover": 0.18
      },
      "volatility_target": {
        "annualized_target": 0.18,
        "enabled": false,
        "lookback_days": 30,
        "maximum_scale": 1.0,
        "minimum_scale": 0.3
      }
    },
    "selected_fraction_per_side": "1/5",
    "side_budget": 0.2
  },
  "risk_config_sha256": "7671efed25b8f9130e8f06fb9dbe44b5735e1cd2f23fd8c20e9dcc1a6b61c30b",
  "seed": 20260801,
  "source_bundle_sha256": "37671ec91a20ce5d52b79d83a5d3a3da6cc57b54674f88fb16d0f41d15ff8cab",
  "strategy_sha256": "39d5a773fef63349fd36282d8b1ae11966fc624f7f4a02f02aa3b9e37bbc482f",
  "team_id": "team-06",
  "thesis": "Common-direction-free relative-rank displacement and persistent leadership should continue over 96 hours with positive aggregate, doubled-cost, bull, bear, and chop behavior in broad zero-net sleeves.",
  "timestamp_utc": "2026-07-16T20:22:45Z"
}
