{
  "candidate_id": "t07-two-tape-rank-durability-v1-base",
  "config_sha256": "bd0e4f70bcf335b2ac4e44ec049b89b8e8eaf4c6ac6502574d0accf12d9d9947",
  "falsifier": "Reject if this exact no-control core fails any official central-development threshold: net Sharpe at least 0.75, positive annualized return, Calmar at least 0.40, maximum drawdown at most 0.30, doubled-cost Sharpe at least 0.35, positive doubled-cost return, trial-adjusted probability positive at least 0.90, four profitable folds, positive-quarter fraction at least 0.55, worst-regime Sharpe at least -0.25, and at least three positive regime Sharpes; or fails any stricter bull, bear, chop, role, sleeve, concentration, A5 coverage, or score-IC gate. Controls, neighbors, and private data cannot rescue it.",
  "family_id": "t07-two-tape-rank-durability-v1",
  "parameters": {
    "_top40_v2_score_adapter": {
      "adapter_id": "top40-v2-declared-score-boundary-v1",
      "manifest_sha256": "0a07bc1908fddb3fbb1052bdab8626d641aeb59b5f68cda7e6b7ba4b7ac3ed70",
      "schema_version": 1
    },
    "bar_interval_hours": 8,
    "block_core_weight": 0.3,
    "cross_tape_disagreement_shrink": 0.15,
    "gross_target": 0.36,
    "history_return_bars": 126,
    "maximum_symbol_exposure": 0.025,
    "minimum_positions_per_side": 8,
    "minimum_tape_bars": 18,
    "minimum_valid_symbols": 24,
    "rebalance_interval_bars": 21,
    "risk_parameters": {
      "drawdown_brakes": [],
      "position_stop": {
        "cooldown_bars": 3,
        "enabled": false,
        "loss_fraction": 0.12
      },
      "same_boundary_reentry": false,
      "side_scaling": {
        "long_scale": 1.0,
        "short_scale": 1.0
      },
      "time_stop": {
        "cooldown_bars": 3,
        "enabled": false,
        "maximum_holding_bars": 21
      },
      "turnover_limit": {
        "enabled": false,
        "maximum_one_way_turnover": 0.35
      },
      "volatility_target": {
        "annualized_target": 0.35,
        "enabled": false,
        "lookback_days": 30,
        "maximum_scale": 1.0,
        "minimum_scale": 0.25
      }
    },
    "selected_fraction_per_side": "1/5",
    "tape_core_weight": 0.7,
    "time_block_bars": 42,
    "time_block_count": 3
  },
  "risk_config_sha256": "d3b918f600f2b548b6a2c8dc44a3077b7b34d8c911ecc6e9c776eada8ad77b6c",
  "seed": 20260801,
  "source_bundle_sha256": "119981c805c575a42b7fb2bf36885e4c2310311e848871cb5676a3eea887439b",
  "strategy_sha256": "bb5b45c3c0de5846463bc8b3164a5921a319ee5a17663ad93b3b6cc7e2224506",
  "team_id": "team-07",
  "thesis": "The exact no-control two-tape rank-durability core should produce positive aggregate and doubled-cost alpha with positive bull, bear, and chop behavior because it selects persistent cross-sectional leaders and laggards that survive both market directions and three time blocks while trading weekly and remaining dollar neutral.",
  "timestamp_utc": "2026-07-16T20:52:48Z"
}
